{
    "invoice_id": "INV5001",
    "side": "buy",
    "source": { "type": "edi210", "doc_uri": null },
    "carrier": { "name": null, "scac": null },
    "customer": { "name": null, "account_id": null },
    "refs": { "bol": "BOL660022", "pro": "PR445566", "po": null, "load_id": null },
    "parties": { "ship_from": "NOVA ELECTRONICS", "ship_to": "BEST BUY RDC", "bill_to": "OURBROKER AP" },
    "dates": { "invoice": "2025-11-04", "pickup": "2025-11-01", "delivery": "2025-11-02" },
    "currency": "USD",
    "charges": {
      "base_freight": 2000.0,
      "fuel_surcharge": 160.0,
      "detention": 90.0,
      "other": []
    },
    "total": 2250.0,
    "metadata": {
      "golden_schema_version": "0.1",
      "parser_version": "1.0.0",
      "edi_version": "005010",
      "trading_partner": "CARRIER5010",
      "confidence": 0.94
    },
    "evidence": { "doc_uri": null, "attachments": [] }
  }
  