{
    "invoice_id": "INV1001",
    "side": "buy",
    "source": { "type": "edi210", "doc_uri": null },
    "carrier": { "name": null, "scac": null },
    "customer": { "name": null, "account_id": null },
    "refs": { "bol": "BOL778231", "pro": "PR0123456", "po": null, "load_id": "LD-56712" },
    "parties": { "ship_from": "XYZ CORP", "ship_to": "ABC DISTRIBUTION", "bill_to": "OURBROKER AP" },
    "dates": { "invoice": "2025-11-01", "pickup": "2025-10-30", "delivery": "2025-11-02" },
    "currency": "USD",
    "charges": {
      "base_freight": 2201.35,
      "fuel_surcharge": 192.45,
      "detention": 150.0,
      "other": []
    },
    "total": 2543.8,
    "metadata": {
      "golden_schema_version": "0.1",
      "parser_version": "1.0.0",
      "edi_version": "004010",
      "trading_partner": "CARRIERX",
      "confidence": 0.95
    },
    "evidence": { "doc_uri": null, "attachments": [] }
  }
  